{
  "primary_delta": 0.25,
  "B_boot": 2000,
  "combo": {
    "combo_in_train": {
      "nP": 35,
      "nE": 842,
      "GEARS_acc": [
        0.7446555819477435,
        0.7159860490729977,
        0.7730070184614515
      ],
      "ADD_acc": [
        0.828978622327791,
        0.7974834755438048,
        0.8574892917514254
      ],
      "ADD_minus_GEARS_acc": [
        0.08432304038004745,
        0.03928170594837266,
        0.12884913880445784
      ],
      "GEARS_AUROC": [
        0.8356698417575664,
        0.8081532844930049,
        0.8631780063127282
      ],
      "ADD_AUROC": [
        0.8975136989808983,
        0.8724691873408978,
        0.920535109981674
      ]
    },
    "combo_seen1": {
      "nP": 23,
      "nE": 581,
      "GEARS_acc": [
        0.7160068846815835,
        0.672666806226925,
        0.7602246277540217
      ],
      "ADD_acc": [
        0.8175559380378657,
        0.7794098331101267,
        0.8542811131617993
      ],
      "ADD_minus_GEARS_acc": [
        0.10154905335628228,
        0.052450054251743275,
        0.15360417262528994
      ],
      "GEARS_AUROC": [
        0.7868349514563107,
        0.7448086687995029,
        0.8292266496250301
      ],
      "ADD_AUROC": [
        0.8994174757281552,
        0.8686399376752703,
        0.9287331226231997
      ]
    },
    "combo_seen0": {
      "nP": 4,
      "nE": 57,
      "GEARS_acc": [
        0.6140350877192983,
        0.5185185185185185,
        0.7090909090909091
      ],
      "ADD_acc": [
        0.8421052631578947,
        0.7777777777777778,
        0.9
      ],
      "ADD_minus_GEARS_acc": [
        0.22807017543859642,
        0.18000000000000005,
        0.26
      ],
      "GEARS_AUROC": [
        0.8185185185185185,
        0.6454545454545454,
        0.935
      ],
      "ADD_AUROC": [
        0.9351851851851851,
        0.9153439153439153,
        0.9768115942028985
      ]
    },
    "interp_pool(seen1+seen0)": {
      "nP": 27,
      "nE": 638,
      "GEARS_acc": [
        0.7068965517241379,
        0.667152725535246,
        0.75
      ],
      "ADD_acc": [
        0.8197492163009404,
        0.785305715678683,
        0.8534095262418592
      ],
      "ADD_minus_GEARS_acc": [
        0.11285266457680254,
        0.0679417020060038,
        0.16053570073601942
      ],
      "GEARS_AUROC": [
        0.7876802096985583,
        0.7474655823834774,
        0.8294655711575991
      ],
      "ADD_AUROC": [
        0.898602009611184,
        0.869766120383768,
        0.9264902446784418
      ]
    },
    "all_combos": {
      "nP": 62,
      "nE": 1480,
      "GEARS_acc": [
        0.7283783783783784,
        0.7036702028258777,
        0.7527507688972523
      ],
      "ADD_acc": [
        0.825,
        0.8016674173106402,
        0.8489514106583073
      ],
      "ADD_minus_GEARS_acc": [
        0.09662162162162158,
        0.06345554429701583,
        0.12860836795842545
      ],
      "GEARS_AUROC": [
        0.8148183886146948,
        0.7892719261545917,
        0.8396936926541573
      ],
      "ADD_AUROC": [
        0.8976500973138104,
        0.8783968749745161,
        0.9154200969320527
      ]
    }
  },
  "single": {
    "single_seen": {
      "nP": 67,
      "nE": 1889,
      "GEARS_acc": [
        0.7818951826363155,
        0.760866230994932,
        0.8023056114202852
      ],
      "noChg_acc": [
        0.6299629433562731,
        0.5750419816756134,
        0.6835300217304341
      ],
      "mean_acc": [
        0.6770778189518264,
        0.6318689667476095,
        0.7234066489361702
      ],
      "GEARS_AUROC": [
        0.8142388285786417,
        0.7922735479590554,
        0.8361959472451944
      ],
      "mean_AUROC": [
        0.7031479544607542,
        0.6830372655269676,
        0.7242055797122637
      ]
    },
    "single_unseen": {
      "nP": 20,
      "nE": 606,
      "GEARS_acc": [
        0.7343234323432343,
        0.6822717415480427,
        0.7790000071137585
      ],
      "noChg_acc": [
        0.5891089108910891,
        0.48652715681404207,
        0.6906430998532704
      ],
      "mean_acc": [
        0.6584158415841584,
        0.5711447391456583,
        0.7414919627662846
      ],
      "GEARS_AUROC": [
        0.75376013859359,
        0.7042601525841077,
        0.7979839118870221
      ],
      "mean_AUROC": [
        0.7477641659073269,
        0.7214380756330857,
        0.7734744432041747
      ]
    }
  },
  "pds": {
    "combo_in_train": {
      "nP": 35,
      "GEARS": 0.9840336134453781,
      "additive": 1.0,
      "mean": 0.7655462184873948
    },
    "combo_seen1": {
      "nP": 23,
      "GEARS": 0.9051383399209485,
      "additive": 1.0,
      "mean": 0.8656126482213439
    },
    "interp_pool(seen1+seen0)": {
      "nP": 27,
      "GEARS": 0.9173789173789174,
      "additive": 1.0,
      "mean": 0.8789173789173789
    },
    "all_combos": {
      "nP": 62,
      "GEARS": 0.9516129032258065,
      "additive": 1.0,
      "mean": 0.8117398202009518
    }
  },
  "delta_sweep": {
    "0.1": {
      "GEARS_acc": [
        0.7351097178683386,
        0.678033275535376,
        0.7936805015761972
      ],
      "ADD_acc": [
        0.7946708463949843,
        0.7487667654164994,
        0.8411383640640413
      ],
      "ADD_minus_GEARS": [
        0.059561128526645746,
        0.02572678893433611,
        0.08934422085145106
      ]
    },
    "0.25": {
      "GEARS_acc": [
        0.7068965517241379,
        0.667152725535246,
        0.75
      ],
      "ADD_acc": [
        0.8197492163009404,
        0.785305715678683,
        0.8534095262418592
      ],
      "ADD_minus_GEARS": [
        0.11285266457680254,
        0.0679417020060038,
        0.16053570073601942
      ]
    },
    "0.5": {
      "GEARS_acc": [
        0.603448275862069,
        0.5586060678451983,
        0.645682297172196
      ],
      "ADD_acc": [
        0.6880877742946708,
        0.6412063280273993,
        0.7327857912838149
      ],
      "ADD_minus_GEARS": [
        0.08463949843260188,
        0.052537525162950155,
        0.1204057738012022
      ]
    },
    "1.0": {
      "GEARS_acc": [
        0.4952978056426332,
        0.4341176376848547,
        0.5537920266559506
      ],
      "ADD_acc": [
        0.5219435736677116,
        0.46165826984517083,
        0.5753698365325918
      ],
      "ADD_minus_GEARS": [
        0.026645768025078398,
        -0.008830558778898587,
        0.061930852029782296
      ]
    }
  }
}